Title,authors
"The Paradise War (The Song of Albion trilogy, Book 1)",['Steve Lawhead']
Is Jesus the Only Savior?,['James R. Edwards']
Danger Quicksand - Have A Nice Day- An unconvential guide to surviving corporate employment,['David St. Lawrence']
Casanova in Bolzano,['Sandor Marai']
Sylvia Browne's Book of Dreams,"['Sylvia Browne', 'Lindsay Harrison']"
The Secret of Wigglesworth's Power,['Albert Hibbert']
The Bachelor Machine,['M. Christian']
The karate dojo;: Traditions and tales of a martial art,['Peter Urban']
The First World War (History of Warfare),['John Keegan']
Live from New York: An Uncensored History of Saturday Night Live,"['Tom Shales', 'James Andrew Miller']"
A child's book of saints,['Louis M. Savary']
The Wind in the Willows,['Kenneth Grahame']
HAMMER AND ANVIL (Book II of The Time of Troubles),['Harry Turtledove']
Winter Solstice,['Rosamunde Pilcher']
"Nutritional Biochemistry, Second Edition",['Tom Brody']
Larry & Lilly Potter: More Than Just Friends,['Larry Brown']
A Hero in Every Heart: Champions from All Walks of Life Share Powerful Messages to Inspire The Hero in Each of Us,['H. Jackson Brown']
The Life of Jesus (Religion),['Shūsaku Endō']
"Gift For Abuelita / Un regalo para Abuelita: Celebrating the Day of the Dead/En celebracion del Dia de los Muertos (English, Multilingual and Spanish Edition)",['Nancy Luenn']
Measurement Error in Nonlinear Models,"['Raymond J. Carroll', 'David Ruppert', 'Leonard A. Stefanski', 'Ciprian M. Crainiceanu']"
S-M: The Last Taboo,"['Gerald Greene', 'Caroline Greene']"
How to lie with statistics / by Darrell Huff,['Darrell Huff']
Better Together : Restoring the American Community,"['Robert D. Putnam', 'Lewis Feldstein']"
Effective cycling,['John Forester']
Luba in America,['Gilbert Hernandez']
Emily's Ghost,['Denise Giardina']
The Purity Principle: God's Safeguards for Life's Dangerous Trails (LifeChange Books),['Randy Alcorn']
The Heart of the Hunter,['Laurens Van Der Post']
The Titan (Meridian classics),['Theodore Dreiser']
Horn of the Hunter: The Story of an African Safari,['Robert Ruark']
Shape of a Pocket,['John Berger']
Emma's Secret,['Barbara Taylor Bradford']
The Long Secret,['Louise Fitzhugh']
The Days of Summer,"['Scott Neustadter', 'Michael H. Weber']"
"The Secret Architecture of Our Nation's Capital: The Masons and the Building of Washington, D.C.",['David Ovason']
Summer of My German Soldier,['Bette Greene']
A Practical Introduction to Econometric Methods:: Classical and Modern,"['Patrick K. Watson', 'Sonja S. Teelucksingh']"
The lollipop party;,['Ruth A. Sonneborn']
The President and Mom's Apple Pie,['Michael Garland']
Understanding history;: A primer of historical method,"['Louis Gottschalk', 'Louis Reichenthal Gottschalk']"
Camera Lucida: Reflections on Photography,['Roland Barthes']
Name Your Baby,['David Narter']
"Teach Us, Amelia Bedelia",['Peggy Parish']
Regulatory and Advanced Regulatory Control: System Development,['Harold L. Wade']
That's Just Your Interpretation: Responding to Skeptics Who Challenge Your Faith,['Paul Copan']
D.V.,['Stu Maschwitz']
The first Crossing of Greenland,['Fridtjof Nansen']
The Greatest Generation,['Tom Brokaw']
Object Oriented Reengineering Patterns (The Morgan Kaufmann Series in Software Engineering and Programming),"['Serge Demeyer', 'Stéphane Ducasse', 'Oscar Marius Nierstrasz', 'Oscar Nierstrasz']"
The Essential Golden Dawn: An Introduction to High Magic,"['Chic Cicero', 'Sandra Tabatha Cicero']"
"Technical analysis of stock trends,","['Robert D. Edwards', 'W.H.C. Bassetti', 'John Magee']"
La Ignorancia,['Manuel G. Velasquez']
"Cooking for Kings: The Life of Antonin Careme, the First Celebrity Chef",['Ian Kelly']
Jump-Off Creek,['Molly Gloss']
Star girl,['Louise Beech']
His Unexpected Wife,['Maureen McKade']
The Bronze Horseman: Selected Poems of Alexander Pushkin,"['Aleksandr Sergeevich Pushkin', 'Александр Сергеевич Пушкин']"
Kirith Kirin,['Jim Grimsley']
Heller with a Gun,"[""Louis L'Amour""]"
Carthage,['Adrian Goldsworthy']
Learning Joy from Dogs Without Collars : A Memoir,['Lauralee Summer']
The Barracks Thief,['Tobias Wolff']
Open: Inside the Ropes at Bethpage Black,['John Feinstein']
Irina's Story,['Jim Williams']
Rocks and Minerals (National Audubon Society First Field Guides),"['Charles Wesley Chesterman', 'National Audubon Society']"
"The Six Sigma Way: How GE, Motorola, and Other Top Companies are Honing Their Performance","['Peter S. Pande', 'Robert P. Neuman', 'Roland R. Cavanagh']"
James Herriot's Favorite Dog Stories,['James Herriot']
The Constant Nymph,['Margaret Kennedy']
The Chicken Pox Panic (The Cul-de-Sac Kids #2) (Book 2),['Beverly Lewis']
Three Little Kittens,['Robert Michael Ballantyne']
Nebula Awards Showcase 2006,['Gardner Dozois']
Ruthie's Gift,['Kimberly Brubaker Bradley']
"Mayor of Casterbridge, the",['Thomas Hardy']
The Four Agreements Companion Book : Using the Four Agreements to Master the Dream of Your Life,"['Don Miguel Ruiz', 'Janet Mills']"
The Beaded Moccasins: The Story of Mary Campbell,['Lynda Durrant']
A Very Young Dancer,['Jill Krementz']
The Devil's Picnic: Around the World in Pursuit of Forbidden Fruit,['Taras Grescoe']
The Very Best Wedding Planner & Organizer,"['Alex Lluch', 'Elizabeth Lluch']"
Hope Dies Last: Keeping The Faith In Troubled Times,['Studs Terkel']
Information Seeking in Electronic Environments (Cambridge Series on Human-Computer Interaction),['Gary Marchionini']
Good Faith and Truthful Ignorance: A Case of Transatlantic Bigamy,"['Alexandra Parma Cook', 'Noble David Cook']"
A book of world religions,['Huston Smith']
American Apartheid,['Douglas Massey']
Spring Awakening,['Frank Wedekind']
Rainbow's End,['Lauren St John']
Caravaggio (Rizzoli Quadrifolio),['Michelangelo Merisi da Caravaggio']
Essential Managers: Writing Your Resume,"['Robert Heller', 'Simon Howard']"
The winter of the world,['Ken Follett']
Abraham Lincoln,"['Abraham Lincoln', 'Bob Blaisdell']"
Roll over and Play Dead,['Joan Hess']
"Halo, Books 1-3 (The Flood; First Strike; The Fall of Reach)","['Eric S. Nylund', 'William C. Dietz']"
The Art of Loving,['Erich Fromm']
Isaiah Effect,['Gregg Braden']
Object-Oriented Database Design Clearly Explained,['Jan L. Harrington']
"Chi Running: A Revolutionary Approach to Effortless, Injury-Free Running","['Danny Dreyer', 'Katherine Dreyer']"
World Pocket Bible,['World Bible Publishing']
Origins of the American Revolution,['Bernard Bailyn']
Baseball pals,['Matt Christopher']
Howl-O-Ween,['Gary L. Holleman']
"On the aesthetic education of man,","['Friedrich Schiller', 'Reginald Snell']"
The Educated Child : A Parents Guide From Preschool Through Eighth Grade,"['Chester E. Finn, Jr.', 'John T. E. Cribb, Jr.', 'William J. Bennett']"
With Cochrane the Dauntless,['David Cordingly']
Zorba the Greek,['Nikos Kazantzakis']
Ulysses S. Grant,"['Josiah Bunting, III']"
Along Came Mary : A Bad Girl Creek Novel,['Jo-Ann Mapson']
Till We Have Faces: A Myth Retold,['C. S. Lewis']
Seven Days to a Magickal New You,['Fiona Horne']
The Starter Marriage: A Novel,['Pamela Paul']
Philosophical investigations = Philosophische untersuchungen,['Ludwig Wittgenstein']
Shaping Seattle Architecture: A Historical Guide to the Architects,['Jeffrey Karl Ochsner']
Charms for the Easy Life,['Kaye Gibbons']
"Saddle and Western Gear Catalog, 1938","['Victor M. Linoff', 'Visalia Stock Saddle Co']"
Walking in Victory: Experiencing True Sanctification and Holiness through God's Grace,['Charles Trumbull']
Hiking Alaska (State Hiking Series),['Mollie Foster']
The World of Musical Comedy,['Stanley Green']
Chimney Swift Towers: New Habitat for America's Mysterious Birds (Louise Lindsey Merrick Natural Environment Series),['Paul D. Kyle']
The black arrow: A tale of the two roses (The biographical edition of the works of Robert Louis Stevenson),['Robert Louis Stevenson']
The New American Bible For Catholics,['John J. Collins']
"UNESCO General History of Africa, Vol. VIII: Africa since 1935 (unabridged paperback)",['Unesco. International Scientific Committee for the Drafting of a General History of Africa']
The Language of Mathematics: Making the Invisible Visible,['Keith Devlin']
Gods and Kings (Chronicles of the Kings #1),['Lynn Austin']
Agatha Raisin and the Love from Hell,['M. C. Beaton']
Daughters of Earth: Feminist Science Fiction in the Twentieth Century,['Justine Larbalestier']
Object-Oriented Design with UML and Java,"['Kenneth Barclay', 'John Savage']"
El sueo de la historia,"['Candelaria Zapp', 'Herman Zapp']"
How to be a Ghost Hunter (How To Series),['Zak Bagans']
Cucina Piemontese: Cooking from Italy's Piedmont,"['Maria Grazia Asselle', 'Brian Yarvin']"
Elbowing the seducer: A novel,['T. Gertler']
"OF PLYMOUTH PLANTATION, 1620-1647",['William Bradford']
The NutriBase Complete Book of Food Counts,['NutriBase']
Grace And Power,['Sally Bedell Smith']
"Candy ('Tang', in traditional Chinese, NOT in English)",['Lan Jiang']
The Third Man,['Graham Greene']
Ghetto Schooling: A Political Economy of Urban Educational Reform,['Jean Anyon']
"Yo, Vikings!",['Judy Schachner']
Carb Conscious Vegetarian: 150 Delicious Recipes for a Healthy Lifestyle,['Robin Robertson']
One Incredible Moment Celebrating The Majesty Of The Manger,['Max Lucado']
The Anger Workbook: A 13-Step Interactive Plan to Help You... (Minirth-Meier Clinic Series),"['Les Carter', 'Frank B. Minirth']"
The Sweetest Dream,['Doris Lessing']
"Righteous Victims: A History of the Zionist-Arab Conflict, 1881-1999",['Benny Morris']
The natural history and antiquities of Selborne,['Gilbert White']
The Map of Tolkien's Middle-earth,['Brian Sibley']
Eton Voices: Interviews,['Mary Ellen Snodgrass']
King of the Dead,['Joseph Nassise']
Ocean Circulation and Climate: Observing and Modeling the Global Ocean (International Geophysics),"['Gerold Siedler', 'John Church', 'John Gould']"
Hang By Your Neck,['Henry Kane']
Man and Superman: A Comedy and A Philosophy,['Bernard Shaw']
Observing the User Experience: A Practitioner's Guide to User Research (Morgan Kaufmann Series in Interactive Technologies),['Mike Kuniavsky']
In the wet,['Nevil Shute']
The Psychic Pathway: A Workbook for Reawakening the Voice of Your Soul,['Sonia Choquette']
Uncle Wiggily Stories,['Howard Roger Garis']
Parliamentary law at a glance: Based on Robert's Rules of order revised,['Ethel C. Utter']
.NET Multithreading,['Juval Löwy']
Critica de la razon ludica / Criticism of the Playful Reason (Estructuras Y Procesos/ Filosofia) (Spanish Edition),['Daniel Goleman']
Free Fall in Crimson,['John D. MacDonald']
Resurrection Day,['Brendan DuBois']
Saint Joan (Penguin books),"['Bernard Shaw', 'Dan H. Laurence']"
T'Ai-Chi Swordplay and Eight-Diagram Palm (Chinese Martial Arts),['Carol A. Wiley']
Sights Unseen,['Kaye Gibbons']
Betrayed,['Milan Kundera']
By Love Undone,['Suzanne Enoch']
Your God is too small,['J.B. Phillips']
Duke: We're Glad We Knew You: John Wayne's Friends and Colleagues Remember His RemarkableLife,['Herb Fagen']
A Girl Called Thursday,['Lilian Harry']
Dr. Richard Marrs' Fertility Book: America's Leading Infertility Expert Tells You Everything You Need to Know About Getting Pregnant,['Richard Marrs']
WIND RIDER'S OATH,['David Weber']
Essential Managers: Learning To Lead,['Robert Heller']
Night,['Clement Moore']
A Recursive Vision: Ecological Understanding and Gregory Bateson,['Peter Harries-Jones']
Baffling Whodunit Puzzles: Dr. Quicksolve Mini-Mysteries,['Jim Sukach']
Shrimp & Spey Flies for Salmon & Steelhead,['Ricardo Calado']
Differential and Integral Calculus : Volume 1,['Richard Courant']
Prisoner 1167: The Madman Who Was Jack the Ripper,['James Tully']
The Mystery in the Cave (The Boxcar Children Mysteries #50),['Gertrude Chandler Warner']
The Cannibal's Wife: A Memoir,"['Yvonne M. Maes', 'Bonita Slunder']"
"The Big Guide To Living And Working Overseas: 3,045 Career Building Resources, Fourth Edition",['Larry Chiagouris']
Object-Oriented Neural Networks in C++,['Joey Rogers']
Lady Into Fox,['David Garnett']
Peterson First Guide to Astronomy,"['Jay M. Pasachoff', 'Roger Tory Peterson']"
Diccionario de los sueos (Spanish Edition),['R.J. Palacio']
Lessons in Wrestling and Physical Culture (Reprint Edition -Originally published in 1914),['Brian Solomon']
"Ruth-Esther (Word Biblical Commentary, Vol. 9)",['Dr. Frederic W. Bush']
The Nightingale's Song,['Robert Timberg']
"'night, Mother: A Play (Mermaid Dramabook)",['Marsha Norman']
Just Another Soldier: A Year on the Ground in Iraq,['Jason Christopher Hartley']
Say It with Charts Workbook,['Gene Zelazny']
The Elders Are Watching,"['David Bouchard', 'Roy Henry Vickers']"
The Sacred Ifa Oracle,"['Afolabi A. Epega', 'Philip John Neimark']"
Taming Rafe,['Suzanne Enoch']
Theodore Roosevelt,['Kathleen Dalton']
Mad Pursuit,['Francis Crick']
Sweet Hands: Island Cooking From Trinidad And Tobago (Hippocrene Cookbook Library),['Ramin Ganeshram']
Harmonium: A Book of Poems,['Paul Mariani']
His Lordship's Holiday Surprise (Zebra Regency Romance),['Kate Huntington']
The Principle of Relativity (Dover Books on Physics),"['Albert Einstein', 'Francis A. Davis']"
Image Processing: The Fundamentals,"['Maria Petrou', 'Costas Petrou']"
William the Conqueror,['David C. Douglas']
Just Another Kid,['Torey Hayden']
Oil Field Chemicals,['Johannes Fink']
Creating the Good Life :Applying Aristotle's Wisdom to Find Meaning and Happiness,"[""James O'Toole""]"
No Comebacks,['Frederick Forsyth']
Arthur Ashe on Tennis,['Paul Mantell']
Why Women Want What They Can't Have: Why So Many Relationships Fail,['Peter Andrew Sacco']
Flirting with Disaster,['Sherryl Woods']
Pictorial Key to the Tarot,['A. E. Waite']
Failure Mode and Effect Analysis: FMEA from Theory to Execution,['D. H. Stamatis']
"I love you, sun I love you, moon",['Karen Pandell']
"Ocean Circulation, Second Edition",['Open University']
Enemy of the People,"['Arthur Miller', 'Henrik Ibsen']"
Death du Jour,['Kathy Reichs']
Return of the Naked Chef,['Jamie Oliver']
UNDER A NEW SKY,['Elizabeth Kolbert']
Siouxsie and the Banshees: The Authorised Biography,"['Mark Paytress', 'Shirley Manson']"
Foundation and Earth,['Isaac Asimov']
1634: The Ram Rebellion (Assiti Shards),"['Eric Flint', 'Virginia Easley DeMarce']"
For a Better World: Posters from the United Nations,['Edward B. Marks']
The Transall Saga,['Gary Paulsen']
Heaven's Prisoners,['James Lee Burke']
Applied Regression Analysis,"['Norman R. Draper', 'Harry Smith']"
"Winter Warriors (Drenai Tales, Book 8)",['David Gemmell']
Atlantic Poets: Fernando Pessoa's Turn in Anglo-American Modernism (Reencounters with Colonialism: New Perspectives on the Americas),"['Irene Ramalho Santos', 'Maria Irene Ramalho Sousa Santos']"
These Honored Dead: How The Story Of Gettysburg Shaped American Memory,['Thomas A. Desjardin']
"Hyperspace: A Scientific Odyssey through Parallel Universes, Time Warps, and the Tenth Dimension",['Michio Kaku']
Chinese Nail Murders,"['Robert Hans van Gulik', 'Robert van Gulik']"
Vector Mechanics for Engineers Combined Edition,"['C. LAKSHAMANA RAO', 'J. LAKSHINARASHIMAN', 'RAJU SETHURAMAN', 'SRINIVASAN M. SIVAKUMAR']"
The Making of McPaper: The Inside Story of USA Today,['Peter Prichard']
Heir to the Throne,['Sarah J. Maas']
"Young in One Another's Arms, The",['Jane Rule']
Leeway Cottage,['Beth Gutcheon']
A Spy Among the Girls (Boy/Girl Battle),['Phyllis Reynolds Naylor']
Design for the Real World: Human Ecology and Social Change,"['Victor Papanek', 'Victor J. Papanek']"
The Barbary Coast: An Informal History of the San Francisco Underworld,['Herbert Asbury']
"A History of Greek Philosophy: Volume 2, The Presocratic Tradition from Parmenides to Democritus","['W. K. C. Guthrie', 'William Keith Chambers Guthrie']"
The Habit: A History of the Clothing of Catholic Nuns,['Elizabeth Kuhns']
Snoopy and the Red Baron,['Charles Schulz']
Basic Arabic Workbook: For Revision and Practice,['John Mace']
"Win, Lose or Die",['John Gardner']
JMX in Action,"['Ben G. Sullins', 'Mark B. Whipple']"
"Occasional, Critical, and Political Writing (Oxford World's Classics)",['James Joyce']
Infamous Scribblers: The Founding Fathers and the Rowdy Beginnings of American Journalism,['Eric Burns']
Autumn: The City,['David Moody']
A Woman of Substance,['Barbara Taylor Bradford']
The Doom Stone,['Paul Zindel']
The Best American Poetry 1993,"['David Lehman', 'Harold Bloom']"
The Short Novels of John Steinbeck,['John Steinbeck']
Altazor (Wesleyan Poetry Series),['Vicente Huidobro']
Darksong Rising - the Third Book of the Spellsong Cycle,"['L. E. Modesitt, Jr.']"
Road & Track Illustrated Automotive Dictionary,['Roy Hession']
Nobody Knows My Name: More Notes of a Native Son,['James Baldwin']
"Imagining Robert: My Brother, Madness, and Survival : A Memoir",['Jay Neugeboren']
COMMUNION A TRUE STORY,['Whitley Strieber']
Peterson First Guide to Urban Wildlife,['Roger Tory Peterson']
All in the Timing,['David Ives']
With a Daughter's Eye: A Memoir of Margaret Mead and Gregory Bateson,['Mary Catherine Bateson']
The Bonfire of the Vanities,['Tom Wolfe']
Conan The Valiant,['Roland Green']
The Marvel Encyclopedia: The Definitive Guide to the Characters of the Marvel Universe,"['DK Publishing, Inc']"
"Convection Heat Transfer, 2nd Edition",['Louis C. Burmeister']
Madeline Vionnet,['Betty Kirke']
I Know A Story,"['The Moth', 'Meg Bowles', 'Catherine Burns', 'Jenifer Hixson', 'Sarah Austin Jenness', 'Kate Tellers']"
"A CHECKLIST OF THE TREES, SHRUBS, HERBS, AND CLIMBERS OF MYANMAR (CONTRIBUTIONS FROM THE UNITED STATES NATIONAL HERBARIUM, VOLUME 45: 1-590).",['Umberto Quattrocchi']
"Geometric Dimensioning and Tolerancing: Applications and Techniques for Use in Design: Manufacturing, and Inspection (Dekker Mechanical Engineering)",['James D. Meadows']
Mere Christianity,['C. S. Lewis']
Hidden Face of Eve: Women in the Arab World,"['Nawal El Saadawi', 'Nawāl Saʻdāwī']"
Easy-to-Sew Playful Toys: 25 Soft Toys with Interactive Fun,['Debra Quatermain']
Growing Pains: The Autobiography of Emily Carr,['Emily Carr']
Living on Purpose: Finding God's Best for Your Life,['Lysa M. TerKeurst']
The Medici Conspiracy: The Illicit Journey of Looted Antiquities--From Italy's Tomb Raiders to the World's Greatest Museums,"['Peter Watson', 'Cecilia Todeschini']"
The Cloister Walk,['Kathleen Norris']
Good Night: The Sleep Doctor's 4-Week Program to Better Sleep and Better Health,['Michael Breus']
The Martin Luther Christmas Book,"['Martin Luther', 'Roland Herbert Bainton']"
The Edge,['Michael Pye']
Lights Out,"['T. S. Wiley', 'Bent Formby']"
Jude the Obscure,['Thomas Hardy']
The Evil of Evils: The Exceeding Sinfulness of Sin (Puritan Writings),['Jeremiah Burroughs']
The Silver Sword,['Ian Serraillier']
Japanese for Everyone: A Functional Approach to Daily Communication,['Susumu Nagara']
The intellectuals and McCarthy: The radical specter,['Michael Paul Rogin']
Light from Heaven (The Mitford Years #9),['Jan Karon']
DRINK WITH THE DEVIL,['Jack Higgins']
The Graves: Srebrenica And Vukovar,['Eric Stover']
THE MANITOUS The Spiritual World Of The Ojibway,['Basil Johnston']
The Long Dark Tea-Time of the Soul,['Douglas Adams']
The Man With a Load of Mischief (The Best Mysteries of All Time),['Martha Grimes']
"American Theocracy: The Peril and Politics of Radical Religion, Oil, and Borrowed Money in the 21stCentury",['Kevin Phillips']
Dougy (Uqp Young Adult Fiction),['James Moloney']
Introduction to Public Health,['Mary-Jane Schneider']
Dress Your Family in Corduroy and Denim,['David Sedaris']
"Peasants, And Other Stories",['Anton Chekhov']
The Collected Poems of A. E. Housman,['A. E. Housman']
Robert The Bruce The Price Of The Kings Peace,['Nigel Tranter']
"A Moment of Silence Marvel Comics Vol. 1 No. 1 (Saluting the Heroes of September 11th, 1)",['M. Keith Booker']
This Book Will Save Your Life,['A.M. Homes']
Mistresses of Mayhem: The Book of Women Criminals,"['Francine Hornberger', 'Francine LaSala']"
The Other Boleyn Girl,['Philippa Gregory']
Introduction to Quantum Mechanics,"['David J. Griffiths', 'Darrell F. Schroeter']"
FREEMASONRY AND ITS ANCIENT MYSTIC RITES,['Charles Webster Leadbeater']
Lord of the flies,['William Golding']
Captain Corelli's Mandolin,['Louis de Bernieres']
ANNIE BESANT: AN AUTOBIOGRAPHY (Adyar Deluxe Edition),['Seth Koven']
The Abyss,['Marguerite Yourcenar']
Jane Austen's Charlotte,"['Julia Barrett', 'Jane Austen']"
The Lost Girl (The Cambridge Edition of the Works of D. H. Lawrence),['D. H. Lawrence']
We The Arcturians: A True Experience,"['Norma J. Milanovich', 'Betty Rice', 'Cynthia Ploski']"
"Ragged Dick and Mark, The Match Boy",['Horatio Alger']
Orson Welles: A Biography,['Barbara Leaming']
The Kimono Inspiration: Art and Art-To-Wear in America,"['Textile Museum (Washington, D.C.)']"
Family Honor - A Sunny Randall Novel,['Robert B Parker']
"In the Balance (Worldwar Series, Volume 1)",['Harry Turtledove']
The Sands of Sakkara,['Glenn Meade']
The Honey Badger,['Randall']
Song Of Unmaking,['Caitlin Brennan']
Lady Molly of Scotland Yard,['Baroness Orczy']
"Sacred Time : A Novel (Hegi, Ursula)",['Ursula Hegi']
The Abduction of Julia,['Karen Hawkins']
How to Write a Movie in 21 Days,['Viki King']
Poetic Justice: The Literary Imagination and Public Life (Alexander Rosenthal Lectures),['Martha Nussbaum']
Stranger With My Face,['Lois Duncan']
100 Ways to Motivate Yourself,['Steve Chandler']
"Sold Down the River (Benjamin January, Book 4)",['Barbara Hambly']
The principles of natural and politic law,['Jean Jacques Burlamaqui']
The Eustace Diamonds,['Anthony Trollope']
Plants That Poison: An Illustrated Guide for the American Southwest,"['Steven Foster', 'Roger A. Caras']"
Last Love in Constantinople: A Tarot Novel for Divination,['Milorad Pavić']
The Marrow of Tradition (Transaction Large Print Books),['Charles W. Chesnutt']
Twisted: The collected stories of Jeffery Deaver,['Jeffery Deaver']
Holidays (National Geographic windows on literacy),"['National Geographic Learning National Geographic Learning', 'Stewart Gardiner']"
Through the narrow gate,['Karen Armstrong']
Disappearing Nightly,['Laura Resnick']
The House Behind the Cedars (Transaction Large Print Books),['Charles W. Chesnutt']
"Starlight (Warriors: The New Prophecy, Book 4)",['Erin Hunter']
Spiritual Tourist,['Mick Brown']
The Kingless Land,['Ed Greenwood']
The longest day,['Cornelius Ryan']
Behold...,['Alan Watts']
Garden Witchery: Magick from the Ground Up,['Ellen Dugan']
Joseph Andrews,['Henry Fielding']
Calvin: Institutes of Christian Religion in 2 Volumes,"['Jean Calvin', 'John Calvin']"
"The Ultimate Priority: John Macarthur, Jr. on Worship",['John MacArthur']
"Power of the Witch: The Earth, the Moon, and the Magical Path to Enlightenment","['Laurie Cabot', 'Tom Cowan']"
Country Lawyer,['Paul R. Clancy']
The Layguide: How to Seduce Women More Beautiful Than You Ever Dreamed Possible No Matter What You Look Like or How Much You Make,"['Tony Clink', 'Bret Witter']"
Teaching Pronunciation: A Reference for Teachers of English to Speakers of Other Languages,"['Celce-Murcia', 'Marianne Celce-Murcia', 'Donna M. Brinton', 'Janet M. Goodwin']"
Architects Today: The 100 Greatest Living Architects,"['Kester Rattenbury', 'Robert Bevan', 'Kieran Long']"
A Primer on Animal Rights: Leading Experts Write About Animal Cruelty and Exploitation,['Kim W. Stallwood']
Sams Teach Yourself Visual C++.NET in 21 Days,"['Duncan Mackenzie', 'Kent Sharkey']"
Poetic Justice: The Literary Imagination and Public Life,['Martha Nussbaum']
Eyerobics,['Marilyn Roy']
The men in blue: Conversations with umpires,['Larry R. Gerlach']
"Community Health Education & Promotion, Second Edition","['Robert J. Bensley', 'Jodi Brookins-Fisher']"
The Mason Jar Cookie Cookbook,['Lonnette Parks']
Besieger of Cities,['Alfred Duggan']
This Side Of The Sky,['Elyse Singleton']
Christmas Delivery,['Patricia Rosemoor']
The world swappers,['John Brunner']
"Saint Pius X,: The farm boy who became Pope (Vision books)",['Walter Diethelm']
The Rebel: An Essay on Man in Revolt,['Albert Camus']
Lilac Spring (Wild Rose Series #2) (Steeple Hill Women's Fiction #31),['Ruth Axtell Morren']
Lonely Planet Denmark (1st ed),"['Glenda Bendure', 'Ned Friary']"
"The German revolution of 1918: A study of German socialism in war and revolt,",['A. J. Ryder']
A Summer of Kings,['Han Nolan']
The Collected Stories,['Jean Stafford']
Rhiana,['Bridget Heos']
The Psychic Healing Book,"['Amy Wallace', 'Bill Henkin']"
"The public and its problems,","['John Dewey', 'Melvin L. Rogers']"
MKSAP for Students 3,['American College of Physicians']
Catspaw,['Joan D. Vinge']
On the Day You Were Born,['Debra Frasier']
The Martian Way,['Isaac Asimov']
Solitary Witch: The Ultimate Book of Shadows for the New Generation,['Silver RavenWolf']
Tofu Quick & Easy,['Louise Hagler']
Resurrection (The Penguin classics),['Leo Tolstoy']
Fair and Tender Ladies.,['Lee Smith']
Raven,['Bernd Heinrich']
Journey to Ixtlan: the Lessons of Don Juan,['Carlos Castaneda']
OUR FATHER ABRAHAM,['Marvin R. Wilson']
Waylaid,['Kim Harrison']
The complete book of home inspection: For the buyer or owner,['Norman Becker']
Into the Wild (Warriors),['Erin Hunter']
"Vampire Mountain (Cirque du Freak, Book 4)",['Darren Shan']
Little Boy Book,['J. P. Carter']
Henry and Beezus,['Beverly Cleary']
The Complete Idiot's Guide to Taoism,"['Brandon Toropov', 'Chadwick Hansen']"
General Douglas Macarthur,['Arthur Herman']
A Conflict of Visions: Ideological Origins of Political Struggles,['Thomas Sowell']
A Horseman Riding By,['R. F. Delderfield']
Multicultural Spanish Dictionary: How Everyday Spanish Differs From Country to Country,['Augustin Martinez']
Blackwell Dictionary of Political Science,"['Stephen W. Green', 'Douglas Ernest']"
The Mountain of Silence: A Search for Orthodox Spirituality,['Kyriacos C. Markides']
The Rise of David Levinsky (Transaction Large Print Books),['Abraham Cahan']
Flash Character Animation Applied Studio Techniques (Applying Studio Techniques),['Lee Purcell']
